title,year,full_text,word_count
behind the bars,2006,"behind the bars.
L/G/B!T/Q youth in prison '
(
An Introduction
This zinc was written to educate and facilitate discussions
amongst the community on the topic of sexual minorities
in the prison system.
The contributors arc pa11icipating in a service learning
requirement set by Portland State University. The class
focused on broadening the horizons of students through
exposure to a variety of topics and issues confronted by
the LGBTQ youth community.
The contributors, Win Win Khine, Megan Chartier,
Daniel Gibson, and Mark Ritter, all met in a course held
during the summer of2006 entitled LGBTQ Youth Needs.
or
Summer Danger appears courtesy her zinc, Small
consolation ..
All proceeds of this zinc go directly to the Sexual
Minority Youth Resource Center, (SMYRC), which
provides a community center and counseling to youth of
the Po1iland Area LGBTQ community, and is located in
Southeast Portland. Hawaii Youth Correctional Facility to Pay over Half a
Million Dollars for ""Relentless Campaign of Harassment"" of
Gay and Transgender Youth
The American Civil Liberties Union announced a $625,000
dollar settlement in the first case in the country to
speci(ically addr.ess the treatment of lesbian, gay,
bisexual, and Lransgender youth in juvenile facilities. The
settlement ends an ACLU federal civil rights lawsuit on
behalf of three young people who faced anti gay and anti
transgender abuse and harassment at the facili ty by staff
and their peers.
Representjng a 17-year old male-to-female transgender girl ,
an 18-year old girl who identifies as gay, and an 18-year
old boy perceived to be gay, the ACLU sued Hawaii's
correctional officials last September because the youth had
been singled out for mistreatment by staff and harassed by
other youLh based on sexua] orientation and gender identity,
and the f0ci1 i.ty (ajled to <1dequately protect them.
In February, a federal judge agreed with the ACLU Lhat
conditions at the Hawaii Youth Correctional Facility (HYCF)
are dangerous, that harassment is pervasive, and that the
facility is ""in a state of chaos.' The court found •a
relentless campaign of harassment ... Lhat included Lhreats of
vi.olence, physical and sexual assaulL, imposed social
isolation, and near constanL use of homophobic slurs.""
Issuing a preliminary injunction to put an immediate halt to
the culture of abuse at the facility, the court blasted
corrections officials for allowing such incidents as the
following to take place:
7 Referring to LGBT youlh, staff routinely used words
like •fag,• ""butchie, • •fruitcake, • ""fucking little
i...; ........ i-. .......... "" ~n~ ""fnrki no cunts. n * Staff dca]t with complaints of hardssmenL by i::;olat:inq
the victims, raLher Lhan dealing wiLh the harasse~s
Lhemsel ves. For example, one Lransgencler w.i.rd w,1s p 1 acE>d in
solitary confinement for six days, where she spent 23 hours
per day under video surveillance with nothing other than her
pillow and a blankeL, all for her ""protection.•
• Frightening incidents of physical harassmt.•nt in th~
l.iv.i.ng quarters and showers are inaclequatc>ly ;idclrt•ssc•<l,
including one incident in which one ward sme,1re<.l s.•mc>n on
another ward's face.
n the settlement, the state of Hawaii agreed to pay $625,000
to the three plaintiffs, to their aLtorncys, and lo cnver
the costs of a courL-appoinLcd consultant l o l:rciin st riff,
help ITYCF' cra[L new policies and procedur·Ps th.-i.t will help
protect lesbian, gay, bisexual, and transgendnr youth from
harm, and create a functioning grievance system for wards
who need to report abuse.
(Lnformal ion from Lhe American Civil Libc>rtie;; Union)
The International Bill of Gender Rights
The International Bill of Gender Rights was auopLed by thn
International ConferencE' on Transge11dc1 Law nncl Emplnyment
Policy (IC'l'LEf') in 1\ugusL of 1993.
#1: The Right To Define Gender JdPntity
All human beings carry within themselves an ever unfnlcling
idea of who they a.H? ;ind what· tllF'y '"" '""' CiJpnbl,• nf .tchiC'vinq.
'l'he i.ndividual 's sens•~ of self is not. clet-Prmir10cl by
chromosomal Si:!X, gf""nitalia, assigned birth sex, or ini.Lial <Jt11der roll.!. 'l'hu;;, th,~ individuc1l's identity and
cap<lbi 1i1 i ,-.~, Cdrmot b,:, circumscribed by whaL socicLy deems
to b~ mc1sculinc or feminine behavior. IL is fundamental that
individual~; hc:ivv the right to define, and Lo redefine as
their lives unfold, Lheir own gender identities, without
rega1·d Lo chromosomal sex, geniLalia, assigned birth sex, or
initial ge11der role.
'!'her:(! CO l'L!, .:ill human beings h<1ve Lhe .L ighL Lo de ( i11e Lhcir
own q1..~t1d<Jr idvnt iLy regardless o[ chromosomal sex,
ganiLalia, assigned birth sex, or initial gender role.
112 : 'l'he Right Lo Free Expression of Gender ldenLity
Giv0n the right Lo define one's own gender idenLity, all
human beings have Lhe corresponding righL Lo free expression
of Lheir self-defined gender identity.
'l'herefore, all hwnan beings have the right to free
e:-:pression of their SL!l E defined gend1..~r identity; and
fur Lht:t-, no individual shall be denied llw11c.m or Civil Righls
lJY vi1t.uc of t.he expressio11 o( a self defined gender
i dt:'t1Li t-y.
#3: The Right to Secure and Retain Employment. and to Receive
Jusl Compensation
Given Lhe economic sLrucLurL! oi modern socieLy, all human
b8ings have a right to Lrain (or and Lo pursue an occupation
or profession as a means of providing shel ler, sustenance,
and Lhe necessicies and bounty of life, for themselves and
for Lhosc dependent upon them; further, alJ human beings
have the righL to secure and tecain employmenL ;;ind Lo
t•::c~=ive jusl compensation for their ldbor legardless of
gender identiLy, chromosomal sex, geni.Lalia, assigned birth
sex, or initial gender role. 'Therefore, individuals shall not be denied Lhe righL L:o
Lrain for and Lo pursue a11 occupc11.ton OL profe:.;sion, nor be
denied the right t.o secure and reLain employment , nor be
denied just compensation for their labor, by virtue of t heir
chromosomal sex, genitalia, assigned birth sex, or initial
gender role, or on the basis of a self-defined gender
identity or the expression Lhereof.
H4: The RjghL of Access Lo Gende1ed Space and ParticipaLion
in Gendered Activity
Given the right to define one's own gender identity and the
corresponding right to free expression o( a self-defined
gender identity, no individual should be denied access Lo a
space or denied parLicipation in an acLiviLy by vi1tue of a
self-defined gender idenLiLy which is not in accord with
chromosomal sex, genitalia, assigned birth sex, or initial
gender role.
Therefore, no indtvjdual shall be denied access to a space
or denied participaLion in an acLjvity by virtue of a self
defined gender idcnLi~y which is not in accord wiLh
chromosomal sex, geniLal ja, assigned birLh sex, or initial
gender role.
#5: The Right to Control and Change One's Own Body
All human beings have Lhe right to control Lheir bodies,
which includes Lhe right to change Lheir bodies
cosmetically, chemically, or surgically, so as to express a
self-defined gender identity.
Therefore, individuals shall noL be denied the r ight: i.:o
change thejr bodit-s as a means of expressing a. self dE!fint:!d
gender idenLity; and further, indjviduals shall not be
denied Human or Civil Rights on the basis thaL Lhey have chdnged Lheir bodies cosmL•Lically, ch•=ically, or
surgically, or desire Lo do so as a means of expressing a
self defined gender identity .
~6: The Right to Competent Medical and Professional Care
Given the individual's dght to define one 's own gender
identity, and the right to change one's own body as a means
o( expressing a self-defined gender identiLy, no individual
should be denied access to competent medical or other
professional care on the basis of the individual's
chromosomal sex, genitalia, assigned birth sex, or initial
gender role.
Therefore, individurtls shall noL be denied the right to
compeLent medical or other professional care on Lhe basis o[
chromosomal sex, genitalia, assigned bir th sex, or initial
gender role, when changing their bodies cosmetically,
chemically, or surgically.
ff7: The Right Lo l""reedom Prom Involuntary Psychiatric
Diagnosis and Treatmcnr
Given the right to define one's own gender identity,
individuals should not be subject to involuntary psychiatric
diagnosis or treatment.
Therefore, individuals shall noL be subject Lo involuntary
psychiatric diagnosjs or treaLment as mentally disordered,
dysphoric, or diseased, on the basis of a self-defined
gender identity or the expression thereof.
#8: The Rjght l'o Sex11nl Expressinn
Given Lhe righL to a self de[ined gender identity, evr--ry
rnnsentinq adult has a corresponding right to free sexual Therefore, no individual's Hwnan 01 Civil Rights shal.l be
denit!d on the basis o( sexual orit:!ntat ion; and furLl1er, no
individual shall be denied llwnan or Civi l Rights (or
expression of a sel f-defined gender identity through private
sexual acts between consenting adults.
119: The Right to Form CommiLLed, Loving Relationships and
Enter lnto Marital ConLracLs
Given that all hwi1an beings have Lhe right Lo free
expression of self-defined gender identities, and the r i ght
to sexual expression as a form of gender expression, al l
human beings have a corresponding right Lo form committed,
loving relationships wiLh one another, and to enter into
marital contracts, regardless of Lheir own or their
partner's chromosomal sex, genitalia, assigned birth sex, or
initial gender role.
There(ore, individuals shall not be denied Lhe .eight to form
commiLLed, loving relationships wiLh one another or Lo enter
into marital contracts by virtue of their own or their
partner's chromosomal sex, genitalia, assigned birth sex, or
initial gender role, or on the basis of their expression of
a self-defined gender identity.
Ul O: 'rhe Right t:o Con9cive, l30ar, or Adopt Children; The
Right Lo Nurture and !lave Custody of Children and Lo
Exercise Parental Capacity
Given the right to form a committed, loving relationship
with another, and Lo enter inLo marital contracts, together
with Lhe right Lo express a self defined gender identity and
the righL to sexual expression, individuals have a corresponding J.1<,;ilt Lo c..:un<.!•' t ve o.r1J bear children, to ctJvl,JL
children, to nurture children, to have custody of children,
and Lo exercise parental capacity wiLh respect to children,
natural or adopted, without regard to chromosomal sex,
genitalia, assigned birth sex, or initial gender role, or by
virtue of a self-defined gender identity or the expression
thereof.
Therefore, individuals shall not be denied the right to
conceive, bear, or adopt children, nor to nurture and have
custody of children, nor to exercise parental capacjty with
respect to children, natural or adopted, on the basis of
their own, their partner's, or their children's chromosomal
sex, genitalia, assigned birth sex, initial gender role, or
by virtue of a self de(inPd gender idenLity or the
expression thereof.
The Queer Protest Over Prison Conditions of 2002
Angered by Governor Gray Davis' prison policies which
include his support of the death penalty and refusal to
release gay life Lerm prisoners, RoberL RosenkranLz and Mark
Smith, a coalition o( queer and prisoners' rights
organizations demonstrated outside of the Governor's
fund.raiser at the San Francisco Lesbian, Gay, Bisexual, and
Tiansgender Community Center. Governor Davis attended Lhis
campaiqn fundraisjng PV<""nL where VIP Lick,'rs were going at a
rate $500 p0r t· ickeL. 'l'h is comes as news reporls surface
daily describing the Pnormous campajgn chesL the governor
already has, with hundreds of thousands of those dollars
used to purchase the governor's favor by the California
Correctjonal Peace Of(icers union.
""Governor- Davis is no friend oE Lhe lesbian, gay, bisexual and transgender corrunun1 ties. 111s pui.t<--'-""'""' 1...uu ............ .._
Lhe incarceraLed, the poor, young people and people of color
many of whom are queer,• corrunenLed Kevin
weaver of California Pris~1 ~ocus. ""We are here Lo give him
a wake up call - thaL he does noL have the queer vote in the
bag so long as he panders to the most oppressive
organizations in the state"" Weaver added.
""Governor D.:ivis' Dcpartmenl of Corrections is responsible
for widespread medical neglect of prison~is wiLh HIV/AIDS
and other li(e-threaLening illnesses. The prison
administration refuses to recognize the human right
of transgender prisoners to appropriate housing, attire and
hormone LreaLments, "" said Deeg Gold of LAGAI Queer
Insurrection.
Among the demands the protesters expressed weLe to abolish
the death penalty, overturn the three strikes law, parole
all eligible l ifers, release gay prisoners Robert
Rosenkrantz & Mark Smith, 110 more prison construction,
healthcare for all prtsoners especially those with HIV/AIDS,
compassionate release for dying prisoners, and Lo stop the
violence against LGBT prisoners.
The demonstration numbered around 50-60 people who picke ted
and chanted various chants ranging from ""Gray Davis you
can't hide , you don't care if prisoners die"" and ""ho ho, hey
hey, how much cash have you raised today"". The Policy of Deliberate Indifference and the
8111 Amendment
The gth amendment of the U.S. constitution states that,
'Excessive bail shall 11ot be required, 11or excessive fines
imposed, nor cruel a11d unusual pu11islm1e11ts inflicted.'
Trans and other sexual minority prisoners face unique
problems when entering the prison system and arc at higher
risk of physical and sexual violence when placed
thoughtlessly in high risk environments. Cases of trans
women being placed in all male prison environments have
been reported repeatedly by advocacy agencies such as the
National Center for Lesbian Rights, (www.nclrights.org).
Despite the obvious elevated dangers posed to the
community in our nation's prisons, the cases have had only
had partial success in the courts.
Technica1Jy defined, the term deliberate indifference means
just what it says--a wanton disregard or informed failure to
provide something which is required, such as medical
treatment or separate quarters to avoid abusive situations.
Deliberate indifference, must be intentional in order for
prison officials to be found guilty of breaking with the 81 h
amendment. Because the challenges sexual minorities face
in prisons have largely been ignored by the prison
administration and courts alike, the policy of deliberate
indifference serves to make the outrageous statement that
somehow ignorance for the needs of this segment of the
prison population can protect officials from any accusations
of wrongdoing, although it often may be deviating from
U.S. Bureau of prisons' standards of care.
Currently only the prisons in California, Hawaii and a few
other states have adopted policies sensitive to the needs for
separate space for Trans-inmates, most often providing an
area shared with the homosexual segment of the ptison
population.
Mark Ritter - -·I.I.-
11-~•ttl·l.l.Halt 1011\1' -•· • 1.11. uon
> t I a t'd . . . R .. i d ·~ . F . M 211 . 1 ."" )t-·S f . i > 1 . : 3 :0 0 8 I 0 b o & . I t"" I , ' . d .. , . "" ~ '· r • t • l r 1 - n Ul . l . "" • "" •n '· t < o "" u d 1 1 t"" .1 ' . f P '• ' ' \ d \, . t ~ : ; . . S m .- . ~. n t . : ~ l . ~ . I . M ~ ""ll M ~ tt.
~3':19. •ontf'<I for !loo<! 11<""1<1 F'orf. Mt. ~•UNY k \\an1trit1 tor ~ftd 1-""off, ,\.zt.:.
Fort. Au.• Dau. \ll)b Mtlon. )bb AtlloA. ~h'~ #Mt )IOb A<'tlOI"". ""Transsexual people who have not had genital surgery arc
generally classified according to their bitih sex for purposes
of prison housing, regardless of how long they may have
lived as a member of the other gender, and regardless of
how much other medical treatment they may have
undergone."" That used to protect transsexual women from
male prisoners. This is called administrative segregation.
The good thing is that it provide them with greater
protection than being housed in the general population.
However, it excludes them from getting recreation,
educational and occupational opportunities, and
associational rights. I like the good thing. Transsexual
women need to be protected from male prisoners. But that
shouldn't keep them from what they need. How can we
improve the prison system? What should we do for them?
Some transsexual prisoners can maintain their honnone
therapy in prison. The policy of the U.S Bureau of P1isons
is lo provide hormones at the level that was maintained
prior to incarceration. The policy provides specifically, ""H
is the policy of the Bureau of Prisons to maintain the
transsexual .inmate at the level of chm1ge existing upon
admission to the Bureau. Should responsible medical staff
detem1ine that either prot,Tfcssive or regressive treatment
changes are indicated, these changes must be approved by
the Bureau of Prisons, Medical Director prior to
implementation. The use of honnones to maintain
scGondary sexual characteristics may be continued at
approximately the same levels as prior to incarceration, but
such use must be approved by the Medical Director."" I like
the fact that transsexual prisoners can still have horrnone in
I
prison. Moreover, the policy care about transsexual
pnsoners. Accounts include descriptions of constant desire to commit
suicide and unremitting depression as transsexual women's
bodies remain incongruent or deteriorate into incongruence
as hormones are denied. Some transsexual imnates who for
years have maintained women's names and identities
struggling to maintain a rudimentary form of female
presentation. Nobody deserves to feel this way.
However, transsexual prisoners don't get the treatment they
need such as physical and psychological support due to
lack of documentation and private physicians. Even if they
have sufficient documentation, p1ison officials may
disregard the policy. How could prison officials go against
their own policy? They should do things according to their
policy. What can wc do so that they would follow their
policy? Fortunately, prisoners have had more success more
recently.
I think it is necessary that they get the treatment because
denial of treatment can be serious and terrible. According
to transsexual inmate treatment issues, trnnsscxual women
feeling fear every minute, day and night, when placement
and tr tinent issues are not addressed by prison officials. Luckily, there are standards of care exist in order to msure
that all patients, irrespective of their legal standing, receive
treatment for medical and mental conditions which if left
untreated would have a permanent, devastating impact
often causing a severe worsening of their conditions.
Standards of care also apply to persons afflicted with
Gender Identity Disorder. Yet a review of letters from
inmates clearly demonstrates standards of care are not
being followed by prison physicians. As a consequence,
those who remain untreated risk higher incidence of
severely deteriorating mental health. An institution's failure
to provide treatment for easily recognizable disorders is
unacceptable and one of the most glaring examples of our
failure as a society to provide treatment for those who most
need it. My question again is what can we do to help these
transsexual prisoners? Some of you may or may not care
about this. But one day what if someone you love tum out
to be transsexual, how would you feel about this? After all,
we are all human being and we should all love and respect
each others regardless of who we are. And as a society, we
should help them out in any way that we can. Together, we
can make a world beautiful.
Win Win Khine Hardships Faced by Transgcndc1 cti Inmates in Our
Nation's Prisons
It is commonly understood that most prison inmates
face a variety of challenges to their physical and emotional
well-being while incarcerated. However, transgendcred
prisoners often face additional and/or more severe
consequences during incarceration as a result of their
sexual minority status. Christopher Daly of the
Trans gendered Law Center tcsti fied in 2005 before the
National P1ison Rape Elimination Commission regarding
the additional challenges transgendered inmates face. l lis
main findings arc summarized here.
Social bias against sexual minorities has resulted in the
over-representation of transsexuals, particularly malc-to
fcmalc, among the national prison population.
Consequences of employment discrimination arc likely
contributing factors: transsexuals denied employment on
the basis of their sexual minority status are oft.en relegated
to the underground economy, where they work as
prostitutes and online sex-workers, or access and sell
honnones illegally to other transgcndcrcd people who lack
the resources to access hormone therapy in legal medical
settings.
Once in prison, transgendered individuals face many forms
of abuse as a result of their gender nonconformity. This
mistreatment comes at the hands of administrators and
prison staff as well as fellow prisoners and varies in nature
and severity:
Trans gendered prisoners' sel f-idcntificd genders arc
routinely disregarded. Pre-operative transsexuals arc
housed according to their genitalia, regardless of secondary
sex characteristics resulting from hormones treatments or
breast implant surgery. Additionally, p1isoners arc
intentionally and repeatedly referred to by names and
pronouns that arc inconsistent with their gender identities.
These references arc often made by prison administrators
and personnel, and attempts to correct them arc often
punished. Trans gendered prisoners are at increased risk of physical
and sexual abuse at the hands of other prisoners as well as
prison slaff because of their sexual minority status. Their
gender ambiguity often makes them popular targets of
sexual attacks at the hands of fellow inmates; !:,'Uards often
allow, pa11icipate in, and encourage this behavior. Inmates
from the general population arc sometimes granted access
by prison guards to transgendered prisoners who have been
placed in isolation for their ""safety"" as a means of reward
or briber .
Transgendered prisoners are denied access lo clothing (e.g.
bras) and supplies (e.g. razors) that would allow them to
dress and groom themselves in a manner consistent with
lheir gender identity.
Transgendered prisoners are often denied access to
resources that are available to the general prison population
such as treatment for drug and alcohol abuse, job training,
recreational activities, etc. The reason given for this
exclusion is usually the ""safety of the prisoner""; however,
substitute resources in a safe environment are rarely Transgendered prisoners are often segregated from the
general prison population out of concern for their safety;
unfortunately, the most common outcome of this
segregation is increased social isolation and decreased
access to services, resources, privileges(such as phone
access) and opportunities for even the most minimal
interaction with other people.
Transgendered prisoners are routinely denied adequate
medical treatment. This often includes a denial ofhonnone
treatments (regardless of whether the prisoner was in the
process of hormone therapy p1ior to their incarceration), or
a lack of supervision as to appropriate dosage adjustments
if treatments are continued and/or possible negative
interactions with other medications. Additionally,
transgendered i1m1ates are sometimes subjected to
inappropriate and degrading examinations of their genitalia
based on the curiosity of medical personnel.
Transgendered prisoners have little means of ~rotection
from these various types of mistreatment. Their gender
ambiguity and sexual minority status put ~1em in a
particularly vulnerable position in an environment already
infamous for its severe and abusive character. Se\ling and using drugs, sell work,
· and steafmg are just a few of the
non-violent, suniYal crimes for which
queer youth are arrested. Association of Social Workers (NASW) and its Kansas
chapter debunked the state's claims that the length of
Limon's sentence is justified because young people who
engage in same-sex intimacy are so impressionable that
they may be swayed into becoming gay. The NASW pointed to
social science evidence that same-sex attractions surface
much earlier in life - well before puberty - and that one
gay sexual experience can' t make someone ""turn"" gay. All proceeds from this zine will be donated to the
Sexual Mi1101ity Youth Resource CenLer (SMYRC).
SMYHC is Cl safely and supporL center for LQB1'Q
youLh in Oregon. They offer skill building groups,
free HIV testing, educaLion on LGBTQ resources,
counseling, pride advocacy, and employment.
Contact SMYRC:
2100 SE Belmont
Portland, OR 97214
Phone: 503.872.9664
www.smyrc.org ",2224
